{
    "Request": {
        "AuthenticationMethods": [
            {
                "Key": "hash-1-asd/asd",
                "Id": "dummy-ConnectKeyId",
                "Description": "dummy"
            }
        ]
    },
    "Steps": [
        {
            "$type": "Core.Entities.Configs.Steps.HttpConfiguration, Core",
            "Id": "TrackingXML",
            "Headers": {
                "Content-Type": "application/x-www-form-urlencoded"
            },
            "Method": "POST",
            "Url": "{{ include 'functions.sbn'; editorlog(getEndpoint()); getEndpoint()}}",
            "Template": "{{ include 'request-body.sbn' }}"
        }
    ],
    "Imports": [],
    "Response": {
        "Body": "{{ include 'response-body.sbn' }}",
        "Headers": {},
        "StatusCode": 200
    }
}